<?xml version="1.0" encoding="UTF-8"?>
<!--
To change this license header, choose License Headers in Project Properties.
To change this template file, choose Tools | Templates
and open the template in the editor.
-->


<modelo
    xmlns:xsi='http://www.w3.org/2001/XMLSchema-instance'
    xsi:noNamespaceSchemaLocation='modelo.xsd'>
    <curso>1</curso>
    <ciclo>DAW</ciclo>
    <nombreciclo>Desarrollo de Aplicaciones Web</nombreciclo>
    <codigoPostal>49600</codigoPostal>
    <comentario>    Este    ciclo   tiene    una     insercion       laboral     del 100%</comentario>
    <temperatura>25</temperatura>
    <codigoAsignatura>LMSIG</codigoAsignatura>
    <profesor codP="ARN" modulo="LMSIG">Amor Rodriguez</profesor>
</modelo>
